date,location,source,source_url,text,title
17.07.2021 17:19:00,Казань,Business-Gazeta.ru,https://www.business-gazeta.ru/news/516153,"В Горкинско-Ометьевском лесу в Казани был замечен водитель, который передвигался по дорогам, предназначенным для велосипедистов и пешеходов. Об этом сообщили очевидцы в соцсетях.Автор ролика возмутился тем, что иномарка ехала по территории парка, в который въезд для машин запрещен. Мужчина указал на то, что он создал опасность для посетителей, в частности для катавшихся на велосипедах детей.Напомним, недавно в Горкинско-Ометьевском лесупоявиласьтрехметровая инсталляция в виде бабочки из переработанного пластика. Автором работы стал победитель конкурса «Казань — город без отходов» 35-летний архитекторАлексей Лазарев. Проект арт-объекта выбрали местные жители в ходе конкурса. Инсталляция разместилась возле зеленого поля.",В Казани водитель иномарки проехался по велодорожке в Горкинско-Ометьевском лесу
17.07.2021 17:20:49,Пермь,«Business Class»,https://www.business-class.su/news/2021/07/17/ministr-stroitelstva-rf-proinspektiroval-hod-rekonstrukcii-naberezhnoi-i-esplanady-v-permi,"В ходе рабочего визита в Пермь 16 июля министр строительства и ЖКХ России Ирек Файзуллин оценил ход работ по благоустройству набережной и 66-го квартала эспланады.На набережной Камы продолжаются работы на участке от Коммунального моста до территории ОАО «Порт Пермь». Осенью здесь будет открыта спортивная зона.Подрядчик завершил внутреннюю отделку спорткомплекса зимнего плавания и здания администрации, установил светодиодные качели, сделал дренаж и основание мини-футбольного поля. Смонтировано оборудование и ограждения на спортивных площадках.Осталось закончить обустройство покрытия: из гранита – на тротуарах и дорожках, из резиновой крошки – на нижней части беговой дорожки, из искусственной травы – на площадке для мини-футбола. Окончанием благоустройства станет установка урн и скамеек.На среднем квартале эспланады (между улицами Попова и Борчанинова) завершено строительство ливневой канализации, ведется монтаж люков. Продолжается устройство монолитной плиты и гранитного покрытия дорожек и площадок. Ведется монтаж металлоконструкций террас и устройство их щебеночного основания, реконструкция наружного освещения, устройство системы видеонаблюдения. Завершение всех преобразований эспланады намечено на 2023 год.Благоустройство обоих городских пространств финансируется в рамках нацпроекта «Жилье и городская среда» и проекта «Пермь 300».Благодаря нацпроекту второй этап возведения ул. Строителей сможет стартовать в этом году.",Министр строительства РФ проинспектировал ход реконструкции набережной и эспланады в Перми
17.07.2021 17:26:59,Симферополь,PR soft,https://123ru.net/smi/magia-soft-li/290259021/,В этом видео но ИГРА пытается нас УБИТЬ каждые 30 секунд. Если понравилось видео то поставь лайки и подпишись на каналИсточник:Ярик Кент(2021-07-17),"Майнкрафт, но ИГРА пытается нас УБИТЬ каждые 30 секунд Майнкрафт троллинг ловушка. Ярик Кент"
17.07.2021 17:26:41,Архангельск,PR soft,https://123ru.net/smi/magia-soft-li/290259012/,Неразлучные друзья Крош и Ежик попадают в безвыходную ситуацию. Чтобы спасти их рассеянного соседа Бараша нужно пожертвовать самой дорогой для Кроша вещью. Зачем бараны забираются на деревья?Источник:Смешарики(2021-07-17),Скамейка - Смешарики 2D 1 сезон Ремастер в FullHD
17.07.2021 17:30:27,Татарстан,АиФ,https://kazan.aif.ru/incidents/grozy_i_grad_mchs_tatarstana_preduprezhdaet_ob_uhudshenii_pogody_18_iyulya,"МЧС Татарстана предупреждает жителей об ухудшении погоды.«Ночью и днём 18 июля на территории Республики Татарстан и в Казани местами ожидаются грозы с кратковременными усилениями ветра до 16-21 м/с; днём локально град», - говорится в сообщении ведомства. В МЧС уточняют, что град ожидается по республике, но не дойдёт до столицы.Жителей просят по возможности не выходить на улицу. Машины не стоить парковать возле деревьев и рекламных конструкций.",Грозы и град: МЧС Татарстана предупреждает об ухудшении погоды 18 июля
17.07.2021 17:49:42,Россия,«Первый Тульский»,https://1tulatv.ru/novosti/160188-v-novomoskovske-proshel-regionalnyy-etap-spartakiady-pensionerov-rossii.html,"17 июля в Новомосковске прошёл региональный этап VII Спартакиады пенсионеров России. Об этом сообщает пресс-служба правительства региона.В этом году на площадке Училища Олимпийского резерва Тульской области собрались порядка 150 участников из 17 муниципальных образований региона. Ограничения по возрасту у мужчин от 60 лет и старше, у женщин - от 55 лет. Самому старшему среди заявленных участников исполнилось 80 лет.Победители региональной спартакиады отправятся представлять Тульскую область на Всероссийский этап, который пройдёт в Белгороде в августе 2021 года.",В Новомосковске прошел региональный этап Спартакиады пенсионеров России
17.07.2021 17:45:29,Дагестан,АиФ,https://dag.aif.ru/incidents/zhitel_dagestana_osuzhden_na_vosem_let_za_ubiystvo_odnoselchanina,"Суд приговорил к восьми годам лишения свободы в колонии строго режима жителя Ботлихского района за убийство своего односельчанина, сообщили «АиФ Дагестан» в пресс-службе республиканского управления СКР.Как установил суд, в марте этого года в селе Муни Ботлихского района Ариф Курамагомедов в нетрезвом состоянии поссорился с односельчанином и ударил его ножом в живот, повредив печень. Раненый скончался по дороге в больницу.Курамагомедов признан виновным по ч. 1 ст. 105 (Убийство) УК РФ.",Житель Дагестана осужден на восемь лет за убийство односельчанина
17.07.2021 17:54:24,Москва,Светлана Аниканова,https://www.youtube.com/watch?v=bVUsPCG8P30,"Мятное печенье - это по-настоящему летний и освежающий десерт к чашечке чая. Ради такого печенья не лень включать духовку, тем более, что готовится оно моментально. Натуральное, без красителей яркое и вкусное печенье. Приготовите, не пожалеете!Ингредиенты:Сливочное масло - 100 гЯйцо - 1 шт.Сахар - 100 г+70 г на обваливание печеньяЛимон - 1 шт.Свежая мята - 7-10 веточекМука - 300 гСода пищевая - 0,5 ч. л.Соль - 0, 5 ч. л.Сахарная пудра - 3-4 ст. л. на обваливание печеньяВидео-рецепт:Шаги приготовления:Всем добра, будьте здоровы!","Свежее мятное печенье с трещинками, ради такого не лень включать духовку!"
17.07.2021 17:41:02,Ульяновск,АиФ,https://ul.aif.ru/incidents/dtp/nachalnik_infekcionnogo_gospitalya_ck_msch_ulyanovska_pogib_v_dtp,"Сегодня, 17 июля, в ДТП на трассе под Саратовом погиб хирург, начальник инфекционного госпиталя ЦК МСЧ Ульяновска Игорь Филимончев, ему было 53 года. Трагической новостью в социальных сетях поделился врач, депутат городской думы Дмитрий Малых.Игорь Филимончев окончил Куйбышевский медицинский институт по специальности «лечебное дело», прошёл интернатуру по хирургии. В 2016 году получил высшую квалификационную категорию и защитил кандидатскую диссертацию. Весной прошлого года участвовал в проведении первой для региона операции пациенту с коронавирусной инфекцией. В марте 2021 года Игоря Евгеньевича назначили начальником инфекционного госпиталя ЦК МСЧ.«Он был моим заместителем, мы начали с ним новую работу — хотели поднять хирургическую службу, онкологическую, — приводит слова главврача ЦК МСЧ Юрия Келина портал73online. — У него были золотые руки, он замечательный руководитель и пользовался большим авторитетом в коллективе. То, что произошло, не укладывается в голове — вот говорю с вами, и слезы наворачиваются. Мы расстались с ним буквально вчера вечером. Надеялись, что наши планы и мечты будут воплощены в жизнь. Но мы обязательно продолжим эту работу. Безмерно жаль, что Игоря Евгеньевича больше нет с нами».Жизнь врача оборвалась в Хвалынском районе Саратовской области. У поворота на село Алексеевка «Мерседес», за рулём которого находился Игорь Филимончев, на встречной полосе врезался в фуру «Вольво», после чего его легковушку отбросило на КамАЗ. После двух столкновений «Мерседес» съехал в кювет и загорелся. Водитель скончался в машине скорой помощи. Обстоятельства ДТП устанавливаются.",Начальник инфекционного госпиталя ЦК МСЧ Ульяновска погиб в ДТП
17.07.2021 18:02:10,Кемерово,PR soft,https://123ru.net/smi/magia-soft-li/290261505/,"РУЛЕТ ИЗ КАБАЧКОВ с начинкой. Быстрая закуска очень вкусно и просто. Сочный нежный ароматный кабачковый рулет украсит любой стол.Ингредиенты:Противень 25 см х 30 смТесто:Цуккини (кабачки) 500 гСыр (твердый) 200 гЯйца (крупные) 3 шт.Соль, черный перец по вкусуСушеный базилик 1…Источник:Люда Изи Кук(2021-07-17)",БЕЗ МУКИ Вкуснейший РУЛЕТ ИЗ КАБАЧКОВ с сыром и творожной начинкой Люда Изи Кук кабачки закуска
17.07.2021 17:01:55,Йошкар-Ола,19rus.info (Абакан),https://yocity12.com/news/proisshestviya/v-yoshkar-ole-na-tsentralnom-plyazhe-utonul-10-letniy-rebenok/,"Йошкар-Ола, 17 июля. На реке Малой Кокшаге в оборудованном для купания месте около Паркового моста в Йошкар-Оле сегодня днем утонул 10-летний мальчик.Информация о происшествии появилась в популярном публичном сообществе ЧП Йошкар-Ола социальной сети «ВКонтакте». Известно, что тело ребенка извлекли из воды спасатели и передали сотрудникам полиции. Обстоятельства трагедии устанавливаются.Как мы писали ранее, на водных объектах Марий Эл с начала года зарегистрировано 29 происшествий, в результате которых погибли 26 человек, включая четырех детей.Фото: vk.com/chp_yola12",В Йошкар-Оле на Центральном пляже утонул 10-летний ребенок
17.07.2021 17:58:23,Ярославль,PR soft,https://123ru.net/smi/magia-soft-li/290261299/,"Манская петля как добраться. Поход на Манскую петлю состоялся в конце сентября, в разгар красивой осени. Манская петля- это изгиб реки Мана. Река Мана протекает в Красноярском крае и впадает в Енисей. Красота Красноярского края, необычно красивая и манит вернуться обратно.Источник:Путешествия по России и СНГ(2021-07-17)",Манская петля как добраться
17.07.2021 17:32:22,Ярославль,PR soft,https://123ru.net/smi/magia-soft-li/290259368/,Целью нашего похода был небольшй фотосет и парочка видео в образе казака времен освоения Сибири в начале 17ого века. То было время когда могучие русские ребята - наши сибиряков предки - шли сюда за многие верста и основывали города! Наш же поход занял всего несколько часов - пешком вдоль реки от…Источник:Путешествия по России и СНГ(2021-07-17),Манская петля. Красноярск. Потрясающие виды на рассвете. Сьемка на GH5 и дрон Mavic Pro
17.07.2021 18:02:21,Тюменская область,MegaTyumen.ru (Тюмень),https://news.megatyumen.ru/posts/zhiteli-ishima-prinyali-uchastie-v-urban-sessii,"накануне, 15 июля, на площадке мультицентра «моя территория» (улица ленина, 7) состоялась урбан-сессия с горожанами по вопросам благоустройства визуального облика города. событие было посвящено открытию проекта «линии города», итогом которого станет экскурсионный маршрут «мартин, проводи!» и пять новых объектов стрит-арта на улицах ишима.программа урбан-сессии состояла из онлайн-трансляции с федеральным экспертом и соорганизатором центра прикладной урбанистики в екатеринбурге, дмитрием протасевичем, а также открытым микрофоном с жителями ишима и диалогом с участниками «линии города 2020», которые в прошлом году создали коллекцию одежды.в блоке «открытый микрофон» ишимцы рассказали, чего им не хватает в городе. мнения сошлись на том, что необходимо озеленить улицу карла маркса и добавить на серые здания ярких красок в виде граффити и уличных артов.чтобы решить проблемы благоустройства, организаторами было предложено летом 2021 года привлечь художников, обучить заинтересованную молодежь работе с дизайн-кодом и создать 5 арт-объектов. а также подготовить команду гидов, рабочую группу для поиска интересных мест в городе и создать экскурсионный маршрут «мартин, проводи!» в мессенджере telegram.— проект «линии города» проходит в ишиме уже третий год. в 2021 году мы решили провести работу по двум направлениям: уличное искусство и история города. мы благодарны участникам урбан-сессии, которые рассказали свое честное мнение о визуальном облике ишима. это поможет всем нам, непосредственно, на этапе реализации, — комментирует менеджер проекта «линии города», зубрилина татьяна.в течении двух месяцев на проекте «линии города» пройдут совместные генерации — арт-сессии с жителями города, образовательные лекций с федеральными и региональными экспертами по стрит-арту и стрит-гиду.",Жители Ишима приняли участие в урбан-сессии
17.07.2021 18:55:02,Москва,PR-inf,https://123ru.net/smi/natalliyakolesnikova-li/290264067/,"Не знаю, как вы, но я постоянно сижу в Ватсапе. Мы с друзьями постоянно делимся друг с другом смешными картинками и видео. Вот только наступает момент, когда делиться уже нечем. И тогда на помощь приходит интернет. Так вот и я нашлаhttps://telephone-video.ruсмешные видео по данной ссылке. Их там не просто много, но очень много. И данный перечень постоянно обновляется. Даже я кое-что добавила. А еще на сайте есть удобный поисковик, свой Топ-100 и категории. Что делает его пользование очень удобным. В общем, заходите сюда и вы, скачивайте видео, делитесь ими и добавляйте свои. Так будет намного интересней и веселее!",Смешные видео Рунета
